Sentence,ProteinName,UniProtId,PhenotypeName,HPOId,type,Label
Here we show that an PROT inhibitor ipragliflozin improves hepatic PHENO in high-fat diet-induced and leptin-deficient (ob/ob) obese mice irrespective of body weight reduction.,SGLT2,P31639,steatosis,HP:0001397,ft,Good-CoM
"Activation of PROT/RANK/OPG system has been implicated in rheumatoid arthritis (RA), Crohn s disease (CD) and ulcerative colitis (UC) [16, 50]; moreover RANKL blockade improves hepatic PHENO and prevents development of diabetes [51].",RANKL,O14788,insulin resistance,HP:0000855,ft,Good-CoM
"More specifically, the effect of PROT on the infiltration of myeloid cells, liver damage and PHENO development was investigated.",MIF,P03971,anemia,HP:0001903,ft,Bad-CoM
"Moreover, a number of candidate genes have been investigated in PHENO susceptibility, including protein C, macrophage inhibitory factor (PROT) and certain miRNAs [18].",MIF,P03971,sepsis,HP:0100806,ft,Bad-CoM
"Finally, PROT contributed to the PHENO and to the impairment of the terminal differentiation of RBCs from the orthochromatic erythroblast to the enucleated reticulocyte/erythrocyte stage.",MIF,P03971,reticulocytosis,HP:0001923,ft,Good-CoM
"Although extremely rare, lesions with the morphology and phenotypic of polyphenotypic small round cell PHENO, rhabdomyosarcoma, or desmoplastic small round cell tumor have been reported to contain either EWS-FLI1 [56] or PROT-ERG fusion genes [76].",EWS,Q01844,tumor,HP:0002664,ft,Good-CoM
"Immunohistochemically, tumor cells showed diffuse strong reactivity for vimentin and patchy strong staining for CD10 in about 50% of cells (Figure 4); there was no staining of PHENO cells for AE1/AE3, desmin, S-100, LCA, PROT, c-kit, and CD31.",CD20,P11836,tumor,HP:0002664,ft,Good-CoM
"PHENO cells showed diffuse strong immunoreactivity for vimentin and patchy strong staining for CD10; no reactivities were found for PROT/AE3, desmin, S-100, LCA, CD20, c-kit, and CD31.",AE1,P02730,Tumor,HP:0002664,ft,Good-CoM
"PROT production is eventually insufficient for maintaining normal blood glucose levels in T1D or T2D, leading to hyperglycemia and secondary complications, including PHENO, kidney dysfunction, and blindness [1, 3, 4].",Insulin,P01308,cardiovascular disease,HP:0001626,ft,Good-CoM
"Sole expression of AML1-ETO failed to generate PHENO in various murine transgenic models, suggesting that additional genetic events might be necessary for PROT-ETO-positive cells to adopt leukemogenic behavior [69].",AML1,Q01196,leukemia,HP:0001909,ft,Bad-CoM
"MM-111, a bispecific PROT/HER3 antibody, reduced HER2/3-PI3K signaling, suppressed HER2-positive xenograft PHENO growth, and showed synergy with trastuzumab or lapatinib against HER2-positive breast cancers in vivo [159].",HER2,P04626,tumor,HP:0002664,ft,Good-CoM
"Of note, the histology of cases 3 and 4 showed a  basal subtype  or  triple negative  (TN) PHENO which is oestrogen receptor (ER), progesterone receptor (PR), and PROT negative.",HER2,P04626,breast cancer,HP:0003002,ft,Good-CoM
"Other drugs belonging to kinase inhibitors class, such as brivanib (which targets PROT and FGFR1), linifanib (which targets PDGFR and VEGFR), sunitinib (which targets PDGFR, VEGFR, c-Kit, and Flt-3), erlotinib (which targets EGFR), and PI-88 (which targets heparanase and sulfatases) are currently being investigated for efficacy and safety in PHENO-phase III clinical trials.",VEGFR2,P35968,liver cancer,HP:0002896,ft,Bad-CoM
The effect of IL-19 on PROT expression and assembly in breast PHENO cells has been investigated [13].,FN,P02751,cancer,HP:0002664,ft,Bad-CoM
"In contrast, activism around prostate PHENO has been much more effective at raising public attention because a positive prostate-specific antigen (PROT) test allows patients to identify their situation for many years before becoming disabled.",PSA,Q9Y617,cancer,HP:0002664,ft,Bad-CoM
"These data indicated that both TGF and PROT were coexpressed in sclera tissues in flashing light-induced myopia model, suggesting that TGF- -CCN2 signaling might play an important role in the ocular growth and development of PHENO.",CCN2,P29279,myopia,HP:0000545,ft,Good-CoM
"The PHENO in this case was an infiltrating solid, trabecular, and microglandular pattern and, in most ACC, the tumor cells were immunohistochemically positive for amylase, lysozyme,  1ACT, S-100 protein, and EMA but were negative for estrogen receptor, progesterone receptor, and PROT protein (Table 2).",HER2,P04626,tumor,HP:0002664,ft,Good-CoM
Clinical and biological data suggest that PHENO tissue produces greater amount of free PROT (fPSA) than normal one and this seems to improve the predictive value of this marker in detecting Pca [24].,PSA,Q9Y617,tumor,HP:0002664,ft,Good-CoM
The results of this study identify a new physiological role for the PROT-LC3B axis as a potential endogenous modulator of PHENO treatment.,PSF,Q16270,colon cancer,HP:0003003,ft,Good-CoM
We examined the association of sleep duration with the stage and grade of tumor as well as PHENO markers (ER and PROT expression).,HER2,P04626,tumor,HP:0002664,ft,Bad-CoM
"73% of participants were definitely interested in colorectal PHENO screening when due, and 79% of men were definitely interested in a discussion about the PROT test.",PSA,Q9Y617,cancer,HP:0002664,ft,Good-CoM
"Despite the potential involvement of other factors in the bone destruction process, prominent expression of PROT by B and T cells in the PHENO lesions seems to play a primary role in the augmentation of bone resorption processes in this disease [10].",RANKL,O14788,periodontal disease,HP:0000704,ft,Good-CoM
This review strives to provide an overview on the clinical applications of PROT and other KLKs as the diagnostic and prognostic markers in prostate PHENO.,PSA,Q9Y617,cancer,HP:0002664,ft,Bad-CoM
"Due to the structural similarities between PROT and other KLKs, possible roles for the other members of KLK family as a biomarker for prostate PHENO have also been explored during the past 25 years.",PSA,Q9Y617,cancer,HP:0002664,ft,Bad-CoM
"AKT (PROT, RAC-PK) is a serine/threonine protein kinase that is involved in the regulation of many cellular processes such as growth, intermediate metabolism, survival, proliferation, invasiveness, and the regulation of PHENO angiogenesis.",PKB,P31749,tumor,HP:0002664,ft,Good-CoM
"A number of studies have shown disturbances to the RANK/RANKL/PROT system in CD patients with altered serum OPG [59, 60, 64] and RANK expression in tissue from CD patients, who had PHENO and reduced markers of bone formation [63, 66 69].",OPG,O00300,decreased bone mineral density,HP:0004349,ft,Good-CoM
"Moreover it should be taken into account that the PROT level does not always correlate well with the PHENO burden and that there are numerous examples of metastatic PCa in the absence of significantly elevated PSA levels, particularly when the tumours are poorly differentiated [36].",PSA,Q9Y617,tumour,HP:0002664,ft,Bad-CoM
"However, the possibility of an increased risk of bladder cancer induced by chronic glucosuria and PHENO among patients who use PROT inhibitors cannot be excluded.",SGLT2,P31639,urinary tract infection,HP:0000010,ft,Bad-CoM
"In addition, several studies reported that reduced expression of CK8/18 can discriminate the basal tumors of BRCA1 mutation carriers from basal tumors of noncarriers [9,10], whereas loss of phosphatase and tensin homolog (PTEN), together with triple-negative (TN; ER-, PR-, PROT-) status, was reported to improve the sensitivity of BRCA1 mutation prediction in a study of Asian breast PHENO patients [11].",HER2,P04626,cancer,HP:0002664,ft,Good-CoM
"We also evaluated correlations between RANK/PROT expression and the variables PHENO size, nodal status, ER, PgR, HER2, Ki67 and breast cancer subtype using the Pearson chi-squared test.",RANKL,O14788,tumor,HP:0002664,ft,Bad-CoM
"If a change in PROT status is found to be significantly frequent in gastric PHENO, management strategy recommendations similar to those of breast cancer should be introduced for gastric cancer, although it will be important to consider that biopsy from metastases/recurrence or metastasectomy is invasive and burdensome for patients.",HER2,P04626,cancer,HP:0002664,ft,Bad-CoM
PROT is present in serum concentrations directly proportionate to adipose tissue mass and is shown to be elevated in human PHENO [54].,Leptin,P41159,obesity,HP:0001513,ft,Good-CoM
"Trastuzumab is a humanized monoclonal antibody targeted against the extracellular portion of the human epidermal growth factor receptor (PROT, p185), which is overexpressed in approximately 15 to 30% of the invasive breast PHENO cases [19 22].",HER2,P04626,cancer,HP:0002664,ft,Good-CoM
"Some latest reports about HRs protein overexpression and PROT gene amplification assessment for breast PHENO by ICC and FISH using FNAC specimens showed excellent concordance rates between FNAC slides and FFPE sections.17 24 The use of FNAC specimens in determining the HRs status and the level of HER2 gene amplification can achieve high sensitivity, accuracy, and reliability.",HER2,P04626,cancer,HP:0002664,ft,Bad-CoM
Luciferase reporter assay was able to confirm SIRT1 to be the direct target of miR-204 and overexpression of miR-204 elevated PROT expression and increased anoikis sensitivity in PHENO cells.,LKB1,Q15831,gastric cancer,HP:0012126,ft,Good-CoM
"By summarizing data on PROT, VEGR, EGFR, mTOR, MET, and other common PHENO targets or signaling pathways, this review attempts to expound the advance of molecular targeted therapy for gastric cancer in recent years.",HER2,P04626,cancer,HP:0002664,ft,Bad-CoM
"This includes how FOXM1 impacts on different subtypes of PHENO, that is, luminal/estrogen receptor positive (ER+), expressing human epidermal growth factor receptor 2 (PROT), basal-like breast cancer (BBC), and triple negative breast cancer (TNBC).",HER2,P04626,breast cancer,HP:0003002,ft,Bad-CoM
"PROT mRNA and protein expression were identified in the cell preparations; however, this study stopped short of directly testing known PAR2 activators in the cell culture model of PHENO.",PAR2,Q9NWF4,insulin resistance,HP:0000855,ft,Bad-CoM
"We also demonstrated the presence of SPARC protein in the MPM PHENO cells as well as the stromal fibroblasts, with our results indicating the stroma as the likely source of the circulating PROT.",SPARC,P09486,tumour,HP:0002664,ft,Bad-CoM
"PROT detected  or  clinically detected , was associated with psychological wellbeing among prostate PHENO survivors.",PSA,Q9Y617,cancer,HP:0002664,ft,Good-CoM
"Regorafenib is a multikinase inhibitor that blocks the activity of protein kinases of several receptors (VEGFR1, VEGFR2, VEGFR3, TIE2, KIT, RET, RAF1, BRAF, PROT, and FGFR) involved in various signaling pathways regulating angiogenesis, PHENO growth, and tumor microenvironment [88].",PDGFR,P09619,tumor,HP:0002664,ft,Bad-CoM
"PROT (CRT), as a multifunctional protein, is involved in a spectrum of cellular processes including inflammation, autoimmunity, and PHENO initiation/progression.",Calreticulin,P27797,cancer,HP:0002664,ft,Good-CoM
"PROT has been found highly expressed in PHENO vasculature and mediates angiogenesis during tumorigenesis showing a potential role in cancer progression (7,8).",Fibronectin,P02751,tumor,HP:0002664,ft,Good-CoM
"In neuroinflammation, macrophage migration inhibitory factor (PROT) is produced and has been suggested to have a putative role in sudden SNHL, Meniere disease, and noise induced PHENO (see Table 2).",MIF,P03971,hearing loss,HP:0000365,ft,Good-CoM
"Our study allowed the determination of a risk gradient for PHENO development in at-risk population, showing that DQ2.2 variant was relevant when associated with PROT.5.",DQ2,O14656,celiac disease,HP:0002608,ft,Bad-CoM
"The comparable tumor initiating potential and similar expression of stem cell marker ALDH1 in HER2+ and PROT  CTCs suggests underlying tumor cell plasticity in these advanced patient-derived breast CTC lines, rather than a hierarchical cancer stem cell model as described in drug resistant subpopulations within established breast PHENO cell lines7,10 15.",HER2,P04626,cancer,HP:0002664,ft,Good-CoM
"Moussa et al[70] found a decrease in visceral sensitivity, fecal protease activity and PROT expression in acute TNBS PHENO rats treated with a fermented soy germ extract, containing phytoestrogens (isoflavones) and serine protease inhibitors (Bowman-Birk Inhibitor).",PAR2,Q9NWF4,colitis,HP:0002583,ft,Good-CoM
"This study showed that anti-apoptotic chrysin may antagonize PHENO-induced retinal angiogenesis and neovascularization through suppressing the up-regulation of HIF-1 , VEGF, and PROT in the retinal vasculature.",VEGFR2,P35968,hyperglycemia,HP:0003074,ft,Good-CoM
"Thus, our results suggest that extracellular TROP2 expression could serve as a prognostic indicator of treatment outcome in prostate cancer, and that targeting PHENO cells with high surface expression of PROT may be an effective way to prevent progression towards castration resistant prostate cancer.",TROP2,P09758,cancer,HP:0002664,ft,Good-CoM
"With regards to local recurrence (LR), only 1 of 79 (1.3%) patients with a CL PHENO had a LR as compared to 21 (5.4%) of luminal A, 15 (6.8%) of luminal B, 6 (28.6%) of the PROT enriched patients, 4 (7.5%) of the basal-like (p<0.001, Table 3, Fig 5).",HER2,P04626,tumor,HP:0002664,ft,Bad-CoM
"These data provide first in vitro and in vivo evidence of the integral role of previously unrecognized crosstalk between BITC, p53/PROT and p73/LKB1 axes in breast PHENO growth-inhibition.",LKB1,Q15831,tumor,HP:0002664,ft,Good-CoM
"Although a number of studies revealed that a variety of mechanisms can stimulate acquired resistance to EGFR-TKI including secondary mutations within EGFR at position T790, mutation in EGFR effector proteins, small-cell lung PHENO histologic transformation and upregulation of parallel receptor tyrosine kinases (e.g., MET, PROT and AXL) [4], the mechanisms responsible for about 20 30% of cases of acquired resistance to EGFR-TKIs are still unknown.",HER2,P04626,cancer,HP:0002664,ft,Bad-CoM
"Moreover, our study showed that c-Src was activated by RANKL in the migration of PHENO cells.13 Furthermore, c-Src expression showed a significantly positive linear relationship with PROT in breast cancer patients,27 indicating the relationship between c-Src and the RANKL/RANK pathway.",RANK,Q9Y6Q6,breast cancer,HP:0003002,ft,Good-CoM
Intravital imaging showed that in vivo PROT inhibition has heterogeneous effect on PHENO cell motility and did not prevent metastasis spread.,LIMK,P53667,tumor,HP:0002664,ft,Good-CoM
"Chi-square test, comparative analysis of survival curve, disease-free survival and COX risk assessment method were used to understand the association of PROT with the occurrence and progression and prognostic significance of cervical PHENO.",ADAR1,P55265,squamous cell carcinoma,HP:0002860,ft,Bad-CoM
"Hormone therapy use was strongly associated with risk of luminal-like PHENO, and less so with risk of PROT-positive or triple-negative cancer.",HER2,P04626,breast cancer,HP:0003002,ft,Bad-CoM
"Compared to control animals, mice with ablation of JNK3 in the germline, mice lacking PROT in leptin receptor expressing cells, and mice lacking JNK3 in Agrp neurons, all display increased food intake, increased adiposity, and PHENO specifically when placed on high-fat diet [34].",JNK3,P53779,insulin resistance,HP:0000855,ft,Good-CoM
"More specifically, genetic deletion of Hif-1  before leukemia initiation by different AML oncogenic mutations (PROT-ETO, MLL-AF9, HOXA9/MEIS1) revealed that loss of Hif-1  expression did not delay PHENO initiation or progression in any of the genetic models tested, and, contrary to previous data, its deletion either did not regulate or rather increased leukemia self-renewal in secondary transplantation experiments [26].",AML1,Q01196,leukemia,HP:0001909,ft,Good-CoM
"Recently, PROT has been reported to be a drug target for acute myeloid PHENO (AML).",LSD1,O60341,leukemia,HP:0001909,ft,Good-CoM
"Osteoprotegerin (PROT) acts as a decoy receptor for receptor activator of nuclear factor kappa-B ligand (RANKL), which allows sufficient microenvironmental conditions to influence PHENO cell migration (Figure 2b) [74, 75].",OPG,O00300,cancer,HP:0002664,ft,Good-CoM
"By hematoxylin and eosin (H&E) staining (data not shown), each of the matched frozen tumors was found to contain greater than 90% PHENO, and after staining for BRG1, these specific samples were also found to be PROT-deficient, which is consistent with IHC of their paraffin-embedded counterparts.",BRG1,P51532,tumor,HP:0002664,ft,Bad-CoM
"To examine whether PROT is associated with plasma level of TH17-, TH1-, and TH2-related cytokines in children with and without asthma, a cross-sectional study of 577 children (ages 6 14 years) with (n = 294) and without (n = 283) PHENO in San Juan (Puerto Rico) was performed.",TRAP,P29965,asthma,HP:0002099,ft,Bad-CoM
"Importantly, the specific interaction of Rho GTPases with PHENO supressor deleted in liver cancer-1 (PROT) has been shown to decrease FAK-dependent localization of paxillin at immature focal adhesions, thus controlling the lifetime of nascent focal adhesions [118].",DLC1,Q9Y238,tumor,HP:0002664,ft,Good-CoM
"Currently, there is no effective target for PHENO except for PROT, which is over-expressed in only about 12% to 27% of gastric cancers31.",HER2,P04626,gastric cancer,HP:0012126,ft,Good-CoM
"In addition, the tumor endothelium expresses 2 albumin-binding proteins, namely, secreted protein acidic and rich in cysteine (PROT) and gp60 receptor [71 73], which may facilitate the uptake and retention of the HSA complex in the PHENO interstitium.",SPARC,P09486,tumor,HP:0002664,ft,Good-CoM
This information would be important for planning further strategies in PHENO treatment with PROT reactivators.,P53,P04637,cancer,HP:0002664,ft,Bad-CoM
"Since 1992, the serum prostate-specific-antigen (PROT) screen was used on a wide population use of this marker helped in early diagnosis of prostate PHENO and thus contributed to improvements in subsequent 5-year survival rates [4 6].",PSA,Q9Y617,cancer,HP:0002664,ft,Good-CoM
"A375 PHENO cells were transfected with a siRNA against Ire-1  (si Ire-1 ), PROT (siCHOP), or a siRNA control (siCtrl).",CHOP,P35638,melanoma,HP:0002861,ft,Bad-CoM
"PROT is also involved in the proteolytic breakdown of the extracellular matrix in PCa tumorigenesis, which contributes to tumor invasion and metastasis,[10] and high serum PSA correlates with mutations in p53 and the overexpression of the B-cell lymphoma 2 protein, which inhibits apoptosis in PHENO cells.",PSA,Q9Y617,tumor,HP:0002664,ft,Bad-CoM
"These proteins include cancer antigen 125 (CA125) in ovarian cancer, alpha-fetoprotein (AFP) in liver cancer, carcinoembryonic antigen (CEA) in colon cancer, and prostate-specific antigen (PROT) in prostate PHENO.",PSA,Q9Y617,cancer,HP:0002664,ft,Good-CoM
"Our findings, which demonstrated prognostic value of p-eIF2  in PHENO, are partially consistent with this previous research, because PROT is also involved in the PERK-p-eIF2  signaling pathway and predicts better DFS in patients with breast cancer.",CHOP,P35638,breast cancer,HP:0003002,ft,Bad-CoM
"RANKL/PROT binding triggers osteoclast differentiation and activation and too much of either results in excess bone resorption leading to PHENO and other bone disorders [46, 47].",RANK,Q9Y6Q6,osteoporosis,HP:0000939,ft,Good-CoM
"Next, to determine the effects of Slug on VEGF-C/PROT-mediated cancer stemness in PHENO cells, we re-expressed Slug in VEGF-C-knockdown BCC cells.",VEGFR3,P35916,skin cancer,HP:0008069,ft,Bad-CoM
Increasing evidence suggests that HER3 is the preferred partner and to a somewhat lesser extent EGFR and PROT for amplified HER2 in breast PHENO [12 14].,HER4,Q15303,cancer,HP:0002664,ft,Good-CoM
The PI3K/AKT pathway significantly contributes to the ligand-driven PROT signaling activities detected by CELx HSF tests in patient-derived PHENO primary cells.,HER2,P04626,breast tumor,HP:0100013,ft,Good-CoM
PROT has been described as a target in breast cancer therapy and the role of HSP27 in the maintenance of PHENO stem cells was pointed out by Wei et al.,HSP27,P04792,breast cancer,HP:0003002,ft,Good-CoM
"It is worth to note that the levels of unphosphorylated proteins other than PROT, like mTOR (Figure 5b), Src and Erk1,2 (Figure S4) increased in PHENO extracts from resveratrol group.",HER2,P04626,tumor,HP:0002664,ft,Bad-CoM
The PROT statuses of PHENO tissues were examined by 18 pathologists at 14 participating centers.,HER2,P04626,tumor,HP:0002664,ft,Bad-CoM
"Furthermore, a recently published study (23) confirmed that PROT and MCT4 regulated the migration and invasion of PHENO, indicating that interaction of metabolic pattern changes in the microenvironment is an important mechanism of tumor progression.",MCT1,P53985,pancreatic cancer,HP:0002894,ft,Good-CoM
"The PHENO cells were diffusely positive for Bcl-2, CD10, PROT, cyclin D1, and Pax-5.",CD20,P11836,tumor,HP:0002664,ft,Good-CoM
"A myriad of studies showed that elevated expression level of PROT in malignant tumors was correlated with poor clinical outcomes in patients with diverse types of solid tumors such as lung cancer [14, 15], PHENO [16, 17], esophageal cancer [18], hepatocellular carcinoma [10], gallbladder carcinoma [19], colorectal cancer [20 23], oral squamous cell carcinoma [24 28], bladder cancer [29], ovarian cancer [30], head and neck squamous cell carcinoma [31], and salivary gland tumor [32].",GLUT1,P11166,breast cancer,HP:0003002,ft,Good-CoM
PROT induces PHENO angiogenesis that has a pivotal role in solid tumor growth and metastasis.,Leptin,P41159,tumor,HP:0002664,ft,Good-CoM
"It was reported that heat shock protein 60 (PROT) is the only ligand of TREM2 that has been identified on the surface of astrocytes and PHENO cells125, and another study showed that nucleic acids may also be a potential ligand of TREM2 on ischemic neurons122.",HSP60,P10809,neuroblastoma,HP:0003006,ft,Good-CoM
"Other protein-encoding genes (FGL2, CTSB, PROT, SLCO2B1, NARF and JTB) have disease related functions, such as viral hepatitis and ileum PHENO.",TPP1,Q96AP0,cancer,HP:0002664,ft,Good-CoM
"To investigate a possible direct tumoricidal effect of PROT on PHENO cells, we analyzed the cell cycle distribution of CL1 cells treated with or without PEDF.",PEDF,P36955,tumor,HP:0002664,ft,Bad-CoM
"In conclusion, serum ferritin is significantly associated with prostate cancer and may serve as a non-invasive biomarker to complement the PROT test in the diagnosis and prognostic evaluation of prostate PHENO.",PSA,Q9Y617,cancer,HP:0002664,ft,Good-CoM
"Previously, we reported that PROT expression significantly impairs medulloblastoma PHENO growth in vitro and in vivo and also alters chemo sensitivity.",SPARC,P09486,tumor,HP:0002664,ft,Good-CoM
"Binding of PROT to RANK initiates osteoclast differentiation/activation, and thus is critical for their survival and promotion of bone resorption, and ultimately plays a role in pathogenesis of postmenopausal PHENO.",RANKL,O14788,osteoporosis,HP:0000939,ft,Good-CoM
"Among the many MCT family members, PROT and MCT4, along with the chaperon protein CD147, stand out as possible therapeutic targets due to their role in PHENO adaptation to the microenvironment.",MCT1,P53985,tumor,HP:0002664,ft,Bad-CoM
"These mutations reduce both the molecular weight and the immunogenicity of PROT-HV, which was developed as a novel anti-PHENO drug candidate, and has been shown to have multiple functions, including fibrinolysis triggered by SAK-mutant, anti-coagulation exerted by hirudin-12, and the inhibition of platelet aggregation induced by RGD [24].",SAK,O00444,atherosclerosis,HP:0002621,ft,Bad-CoM
"To gain further insights into the regulation of Chk1 by PROT, we examined the expression of Chk1 and ATX3 in several human PHENO cell lines.",ATX3,P54252,cancer,HP:0002664,ft,Bad-CoM
"The expression of genes such as BMP-2, COLLIA1, OCN (which demonstrate an anabolic effect) and PHENO of others like PROT (leading to suppression of osteoclast activity), all stimulated by statins, may regulate the role of this class of drugs in bone formation.",RANKL,O14788,depression,HP:0000716,ft,Bad-CoM
There is preclinical evidence in other PHENO types that RAF inhibitors increase MAP kinase pathway activity by inducing C-RAF heterodimers or B-PROT homodimers[10-12].,RAF,P04049,tumor,HP:0002664,ft,Bad-CoM
"Moreover, preliminary data would seem to show that cannabinoid agonists may increase the efficacy of PROT in the therapy of brain PHENO.",MLT,Q9UDY8,glioblastoma,HP:0100843,ft,Bad-CoM
"However, the immunofluorescence signal intensity of NR2B (Figure 6C) and the fluorescence density ratio of NR2B/NR2A (Figure 6D) in the CA3 of APP/PS1 transgenic animals with chronic monoarthritis PHENO were higher than those in any other group, and those in the APP/PROT transgenic animals without chronic monoarthritis pain were higher than those from WT animals with or without chronic monoarthritis pain.",PS1,P49768,pain,HP:0012531,ft,Bad-CoM
Changes in the protein sequence can affect its activity and result in PHENO due to PROT-induced osteoclastogenesis.,RANKL,O14788,increased bone resorption,HP:0002797,ft,Good-CoM
"Mutations in the SLC25A12, which encodes the mitochondrial aspartate-glutamate carrier isoform 1 (PROT), were identified in patients presenting a developmental delay, hypotonia and intractable PHENO associated with a global hypomyelination in the brain (Wibom et al., 2009; Falk et al., 2014).",AGC1,P16112,seizures,HP:0001250,ft,Good-CoM
